experiment,sentence,response,response_round,subtype,type,lexicalization
Belova_2023,О нужных продуктах позаботится они семеро.,1.6666666666666667,2.0,quantiifier,stimul,30.0
Belova_2023,Со свадебными фотографами свяжется двое из нас.,3.625,4.0,quantiifier,stimul,25.0
Belova_2023,Они двое переночует в больших палатках.,2.090909090909091,2.0,quantiifier,stimul,19.0
Belova_2023,В соседние страны переедут трое из них.,5.777777777777778,6.0,quantiifier,stimul,32.0
Belova_2023,В важные переговоры вмешаемся мы шестеро.,4.0,4.0,quantiifier,stimul,29.0
Belova_2023,Мы семеро отдохнёт на южных курортах.,1.4444444444444444,1.0,quantiifier,stimul,24.0
Belova_2023,За выполненные задачи отчитаются все из них.,4.0,4.0,quantiifier,stimul,43.0
Belova_2023,Трое из нас вложится в перспективные акции.,3.2,3.0,quantiifier,stimul,44.0
Belova_2023,Трое из них переедет в соседние страны.,3.25,3.0,quantiifier,stimul,32.0
Belova_2023,Шестеро из нас приберётся в старых кладовках.,2.6666666666666665,3.0,quantiifier,stimul,47.0
Belova_2023,Семеро из нас уволятся с нынешних позиций.,5.6,6.0,quantiifier,stimul,18.0
Belova_2023,В карнавальные костюмы переоденутся мы семеро.,2.0,2.0,quantiifier,stimul,6.0
Belova_2023,С проведением экзаменов поможет мы четверо.,1.75,2.0,quantiifier,stimul,3.0
Belova_2023,На конкурсе чтецов победит двое из них.,4.555555555555555,5.0,quantiifier,stimul,37.0
Belova_2023,За поломанные инструменты ответим мы все.,4.875,5.0,quantiifier,stimul,35.0
Belova_2023,Семеро из нас возьмётся за новые проекты.,3.272727272727273,3.0,quantiifier,stimul,42.0
Belova_2023,Мы семеро переоденемся в карнавальные костюмы.,3.727272727272727,4.0,quantiifier,stimul,6.0
Belova_2023,В старых кладовках приберутся мы шестеро.,1.8888888888888888,2.0,quantiifier,stimul,47.0
Belova_2023,В байдарочные походы отправятся они четверо.,3.0,3.0,quantiifier,stimul,27.0
Belova_2023,Все из нас женятся в течение месяца.,5.0,5.0,quantiifier,stimul,16.0
Belova_2023,К поисковым отрядам присоединится они пятеро.,1.7777777777777777,2.0,quantiifier,stimul,28.0
Belova_2023,Все из нас согласятся на предложения конкурентов.,4.7,5.0,quantiifier,stimul,14.0
Belova_2023,С кредитными долгами рассчитаются мы все.,2.571428571428572,3.0,quantiifier,stimul,23.0
Belova_2023,В перспективные акции вложимся все из нас.,2.6666666666666665,3.0,quantiifier,stimul,44.0
Belova_2023,Мы шестеро ответит за поломанные инструменты.,2.75,3.0,quantiifier,stimul,35.0
Belova_2023,В больших палатках переночует двое из нас.,5.444444444444445,5.0,quantiifier,stimul,19.0
Belova_2023,Мы все переедут в соседние страны.,1.4,1.0,quantiifier,stimul,32.0
Belova_2023,Четверо из нас поможем с проведением экзаменов.,1.5,2.0,quantiifier,stimul,3.0
Belova_2023,Они трое переедет в соседние страны.,1.5,2.0,quantiifier,stimul,32.0
Belova_2023,Мы четверо разберутся со сломанными телефонами.,1.6666666666666667,2.0,quantiifier,stimul,9.0
Belova_2023,С артистами спектакля познакомятся они все.,4.666666666666667,5.0,quantiifier,stimul,33.0
Belova_2023,За первые парты сядут четверо из них.,5.444444444444445,5.0,quantiifier,stimul,39.0
Belova_2023,Четверо подозреваемых будут опрошены повторно.,5.862068965517241,6.0,good,filler,
Belova_2023,Мы все присоединятся к поисковым отрядам.,3.5,4.0,quantiifier,stimul,28.0
Belova_2023,На пятничную вечеринку придут все из них.,4.444444444444445,4.0,quantiifier,stimul,1.0
Belova_2023,В разные аэропорты прилетят трое из них.,5.555555555555555,6.0,quantiifier,stimul,8.0
Belova_2023,На студенческих конференциях выступим четверо из нас.,2.7777777777777777,3.0,quantiifier,stimul,21.0
Belova_2023,Мы все съездим в отдалённые деревни.,4.0,4.0,quantiifier,stimul,20.0
Belova_2023,Четверо из нас извинится за допущенные ошибки.,2.7777777777777777,3.0,quantiifier,stimul,45.0
Belova_2023,За выполненные задачи отчитаются двое из них.,6.0,6.0,quantiifier,stimul,43.0
Belova_2023,Они все поступят в столичные вузы.,6.333333333333333,6.0,quantiifier,stimul,17.0
Belova_2023,Двое из нас придём на пятничную вечеринку.,1.8333333333333333,2.0,quantiifier,stimul,1.0
Belova_2023,Мы шестеро рассчитаются с кредитными долгами.,3.25,3.0,quantiifier,stimul,23.0
Belova_2023,Мы пятеро прикрепится к новым поликлиникам.,1.6666666666666667,2.0,quantiifier,stimul,40.0
Belova_2023,В столичные вузы поступим все из нас.,2.6666666666666665,3.0,quantiifier,stimul,17.0
Belova_2023,В больших палатках переночует двое из них.,3.888888888888889,4.0,quantiifier,stimul,19.0
Belova_2023,С поставщиками продуктов созвонимся мы пятеро.,4.0,4.0,quantiifier,stimul,10.0
Belova_2023,Двое из нас остановимся в дешёвых хостелах.,1.6,2.0,quantiifier,stimul,7.0
Belova_2023,Они шестеро подметут в учебных кабинетах.,3.333333333333333,3.0,quantiifier,stimul,41.0
Belova_2023,В течение месяца женятся все из нас.,4.0,4.0,quantiifier,stimul,16.0
Belova_2023,На проходной завода отметятся трое из них.,5.444444444444445,5.0,quantiifier,stimul,38.0
Belova_2023,Пятеро из нас искупаемся в крещенской проруби.,3.0,3.0,quantiifier,stimul,4.0
Belova_2023,Все из нас свяжутся со свадебными фотографами.,3.0,3.0,quantiifier,stimul,25.0
Belova_2023,Мы трое прилетят в разные аэропорты.,1.4444444444444444,1.0,quantiifier,stimul,8.0
Belova_2023,Со сломанными телефонами разберутся четверо из нас.,5.0,5.0,quantiifier,stimul,9.0
Belova_2023,Четверо из нас сядут за первые парты.,6.2,6.0,quantiifier,stimul,39.0
Belova_2023,Все из нас переночуют в больших палатках.,4.0,4.0,quantiifier,stimul,19.0
Belova_2023,Мы семеро запишутся в спортивные секции.,1.3333333333333333,1.0,quantiifier,stimul,12.0
Belova_2023,С очевидцами аварии побеседуют они пятеро.,3.375,3.0,quantiifier,stimul,34.0
Belova_2023,В научных журналах опубликуемся мы трое.,3.75,4.0,quantiifier,stimul,2.0
Belova_2023,На акустической гитаре сыграют двое из них.,5.666666666666667,6.0,quantiifier,stimul,13.0
Belova_2023,Они пятеро побеседуют с очевидцами аварии.,4.0,4.0,quantiifier,stimul,34.0
Belova_2023,Семеро из них объявят о скорых отставках.,6.0,6.0,quantiifier,stimul,36.0
Belova_2023,В карнавальные костюмы переоденется семеро из них.,4.333333333333333,4.0,quantiifier,stimul,6.0
Belova_2023,Трое из них прилетят в разные аэропорты.,5.090909090909091,5.0,quantiifier,stimul,8.0
Belova_2023,Все из нас отдохнут на южных курортах.,4.6,5.0,quantiifier,stimul,24.0
Belova_2023,Пятеро из них искупается в крещенской проруби.,2.5,2.0,quantiifier,stimul,4.0
Belova_2023,Двое из нас переночуют в больших палатках.,6.5,6.0,quantiifier,stimul,19.0
Belova_2023,В лесных озёрах порыбачим двое из нас.,2.4444444444444446,2.0,quantiifier,stimul,31.0
Belova_2023,О скорых отставках объявят все из нас.,3.2222222222222223,3.0,quantiifier,stimul,36.0
Belova_2023,Они все справятся с заменой лампочек.,5.0,5.0,quantiifier,stimul,11.0
Belova_2023,Они пятеро созвонится с поставщиками продуктов.,1.6,2.0,quantiifier,stimul,10.0
Belova_2023,С кредитными долгами рассчитается шестеро из них.,3.888888888888889,4.0,quantiifier,stimul,23.0
Belova_2023,На акустической гитаре сыграем все из нас.,2.6666666666666665,3.0,quantiifier,stimul,13.0
Belova_2023,Трое из нас переедет в соседние страны.,2.6666666666666665,3.0,quantiifier,stimul,32.0
Belova_2023,Они пятеро прикрепится к новым поликлиникам.,2.333333333333333,2.0,quantiifier,stimul,40.0
Borisova_2024,"В пятницу Коля перекрасил стены и спальной, и детской комнат.",5.0,5.0,coordination,stimul,12.0
Borisova_2024,"На занятии Вася повредил динамики и стационарного, и портативного компьютера.",5.538461538461538,6.0,coordination,stimul,17.0
Borisova_2024,После отпуска Маша подлатала ручки замшевой и холщовой сумок.,6.25,6.0,coordination,stimul,13.0
Borisova_2024,"В пятницу Коля перекрасил и спальную, и детскую комнаты.",5.166666666666667,5.0,coordination,stimul,12.0
Borisova_2024,"На концерте Степа спел куплеты и дореволюционной, и советской песни.",4.0,4.0,coordination,stimul,21.0
Borisova_2024,"В декабре Юра включил лампочки и белой, и разноцветной гирлянд.",4.428571428571429,4.0,coordination,stimul,28.0
Borisova_2024,"В пятницу Коля перекрасил стены и спальной, и детской комнаты.",4.363636363636363,4.0,coordination,stimul,12.0
Borisova_2024,На каникулах Света перешила шелковую и ситцевую блузки.,6.0,6.0,coordination,stimul,29.0
Borisova_2024,"Во время похода Гриша сфотографировал берега и глубокой, и мелкой рек.",5.333333333333333,5.0,coordination,stimul,18.0
Borisova_2024,"На празднике Катя прочитала строки и латинской, и древнегреческой оды.",5.166666666666667,5.0,coordination,stimul,4.0
Borisova_2024,"Перед спектаклем Петя вымыл ступени и черной, и парадной лестницы.",5.307692307692308,5.0,coordination,stimul,15.0
Borisova_2024,В марте Лиза посадила саженцы русского и американского клена.,6.0,6.0,coordination,stimul,16.0
Borisova_2024,До обеденного перерыва Алиса подписала бумаги бухгалтера и секретаря.,5.989130434782608,6.0,good,filler,33.0
Borisova_2024,"При переезде Даня помял и картонную, и жестяную коробку.",5.0,5.0,coordination,stimul,31.0
Borisova_2024,"В среду Сеня выучил следствия и алгебраической, и геометрической теоремы.",5.0,5.0,coordination,stimul,5.0
Borisova_2024,Перед концертом Аня настроила струны классической и гавайской гитары.,5.888888888888889,6.0,coordination,stimul,7.0
Borisova_2024,"В декабре Юра включил и белую, и разноцветную гирлянду.",5.0,5.0,coordination,stimul,28.0
Borisova_2024,Перед спектаклем Петя вымыл ступени черной и парадной лестницы.,5.333333333333333,5.0,coordination,stimul,15.0
Borisova_2024,"Перед уходом Ира закрыла дверцы и книжного, и платяного шкафов.",6.2,6.0,coordination,stimul,3.0
Borisova_2024,Во время похода Гриша сфотографировал берега глубокой и мелкой рек.,5.2,5.0,coordination,stimul,18.0
Borisova_2024,"После представления Егор оставила шнурки и ботинок, и туфель.",1.553191489361702,2.0,bad,filler,33.0
Borisova_2024,"Во время прогулки Дима нашел и сибирскую, и китайскую ели.",4.833333333333333,5.0,coordination,stimul,2.0
Borisova_2024,Во вторник Тася постирала рукава фиолетовой и желтой водолазок.,6.090909090909091,6.0,coordination,stimul,20.0
Borisova_2024,Через неделю Вова унес кучи листьев и мусора.,4.967032967032967,5.0,good,filler,33.0
Borisova_2024,Во время звонка Эля сломала старый и новый телефон.,3.8333333333333335,4.0,coordination,stimul,9.0
Borisova_2024,После аварии Миша поменял личный и рабочий автомобиль.,4.181818181818182,4.0,coordination,stimul,1.0
Borisova_2024,"За каникулы Варя вспомнила правила и английского, и французского языка.",5.833333333333333,6.0,coordination,stimul,19.0
Borisova_2024,"За обедом Костя съел остатки и капустного, и яблочного пирога.",6.166666666666667,6.0,coordination,stimul,27.0
Borisova_2024,"Во вторник Тася постирала рукава и фиолетовой, и желтой водолазок.",5.125,5.0,coordination,stimul,20.0
Borisova_2024,В четверг Леня посмотрел итальянский и немецкий фильм.,4.2727272727272725,4.0,coordination,stimul,8.0
Borisova_2024,"Во время ужина Поля разбила и чайный, и кофейный сервизы.",5.642857142857143,6.0,coordination,stimul,25.0
Borisova_2024,"На мастер-классе Рома нарисовал и военный, и пиратский корабль.",5.166666666666667,5.0,coordination,stimul,24.0
Borisova_2024,За ужином Нина показала фотографии и рисунки.,6.610526315789474,7.0,good,filler,33.0
Borisova_2024,"Перед уходом Ира закрыла дверцы и книжного, и платяного шкафа.",5.25,5.0,coordination,stimul,3.0
Borisova_2024,На мастер-классе Рома нарисовал военный и пиратский корабль.,4.818181818181818,5.0,coordination,stimul,24.0
Borisova_2024,"На каникулах Света перешила пуговицы и шелковой, и ситцевой блузки.",5.2727272727272725,5.0,coordination,stimul,29.0
Borisova_2024,"Перед уроком Настя испачкала страницы и толстой, и тонкой книги.",5.25,5.0,coordination,stimul,26.0
Borisova_2024,"За обедом Костя съел и капустный, и яблочный пирог.",5.785714285714286,6.0,coordination,stimul,27.0
Borisova_2024,"На прошлой неделе Ксюша прослушала части и фортепианного, и скрипичного концерта.",5.0,5.0,coordination,stimul,32.0
Borisova_2024,"За выходные Вика заштопала и лыжную, и охотничью куртки.",6.2727272727272725,6.0,coordination,stimul,23.0
Borisova_2024,На зимних каникулах Марк купил лыжи и коньки.,6.673913043478261,7.0,good,filler,33.0
Borisova_2024,"После отпуска Маша подлатала и замшевую, и холщовую сумку.",4.636363636363637,5.0,coordination,stimul,13.0
Borisova_2024,За час до выхода Игорь записала адрес и номер.,1.947368421052632,2.0,bad,filler,33.0
Borisova_2024,"За два часа Леша починил ножки и деревянного, и пластмассового столов.",6.2727272727272725,6.0,coordination,stimul,11.0
Borisova_2024,В марте Лиза посадила русский и американский клены.,4.909090909090909,5.0,coordination,stimul,16.0
Borisova_2024,"В командировке Даша посетила музеи и столичного, и провинциального городов.",5.636363636363637,6.0,coordination,stimul,22.0
Borisova_2024,В командировке Даша посетила музеи столичного и провинциального городов.,5.0,5.0,coordination,stimul,22.0
Borisova_2024,"На занятии Вася повредил динамики и стационарного, и портативного компьютеров.",6.583333333333333,7.0,coordination,stimul,17.0
Borisova_2024,"За обедом Костя съел и капустный, и яблочный пироги.",5.923076923076923,6.0,coordination,stimul,27.0
Borisova_2024,"На каникулах Света перешила и шелковую, и ситцевую блузку.",5.769230769230769,6.0,coordination,stimul,29.0
Borisova_2024,Перед уходом Ира закрыла дверцы книжного и платяного шкафов.,6.083333333333333,6.0,coordination,stimul,3.0
Borisova_2024,"После отпуска Маша подлатала и замшевую, и холщовую сумки.",6.25,6.0,coordination,stimul,13.0
Borisova_2024,"Во время уборки Таня почистила подлокотники и кожаного, и плюшевого диванов.",6.1,6.0,coordination,stimul,6.0
Borisova_2024,Перед завтраком Надя выпили стаканы воды и сока.,1.925531914893617,2.0,bad,filler,33.0
Borisova_2024,На каникулах Света перешила шелковую и ситцевую блузку.,4.916666666666667,5.0,coordination,stimul,29.0
Borisova_2024,На концерте Степа спел куплеты дореволюционной и советской песни.,4.909090909090909,5.0,coordination,stimul,21.0
Borisova_2024,После экзамена Лева узнали оценки двоечников и троечников.,1.7204301075268815,2.0,bad,filler,33.0
Borisova_2024,"В декабре Юра включил и белую, и разноцветную гирлянды.",5.0,5.0,coordination,stimul,28.0
Borisova_2024,"Во время уборки Таня почистила и кожаный, и плюшевый диваны.",5.166666666666667,5.0,coordination,stimul,6.0
Borisova_2024,В этом сентябре Инна встретил жен одноклассника и однокурсника.,2.136842105263158,2.0,bad,filler,33.0
Borisova_2024,"В четверг Леня посмотрел отрывки и итальянского, и немецкого фильмов.",5.333333333333333,5.0,coordination,stimul,8.0
Borisova_2024,Во время похода Гриша сфотографировал глубокую и мелкую реки.,5.785714285714286,6.0,coordination,stimul,18.0
Borisova_2024,В командировке Даша посетила столичный и провинциальный город.,4.0,4.0,coordination,stimul,22.0
Borisova_2024,"На празднике Катя прочитала строки и латинской, и древнегреческой од.",5.0,5.0,coordination,stimul,4.0
Borisova_2024,За обедом Костя съел капустный и яблочный пироги.,6.333333333333333,6.0,coordination,stimul,27.0
Borisova_2024,После отпуска Маша подлатала ручки замшевой и холщовой сумки.,4.636363636363637,5.0,coordination,stimul,13.0
Borisova_2024,"В командировке Даша посетила и столичный, и провинциальный город.",4.833333333333333,5.0,coordination,stimul,22.0
Borisova_2024,При переезде Даня помял картонную и жестяную коробки.,5.545454545454546,6.0,coordination,stimul,31.0
Borisova_2024,"Во время уборки Таня почистила и кожаный, и плюшевый диван.",5.166666666666667,5.0,coordination,stimul,6.0
Borisova_2024,"В июне Гоша украл шины и рейсового, и экскурсионного автобуса.",4.75,5.0,coordination,stimul,14.0
Borisova_2024,"В декабре Юра включил лампочки и белой, и разноцветной гирлянды.",5.181818181818182,5.0,coordination,stimul,28.0
Borisova_2024,На этой неделе Максим сдала решения лабораторных и проверочных.,1.8369565217391304,2.0,bad,filler,33.0
Borisova_2024,"Во время звонка Эля сломала и старый, и новый телефоны.",5.428571428571429,5.0,coordination,stimul,9.0
Borisova_2024,"Во вторник Тася постирала и фиолетовую, и желтую водолазки.",5.909090909090909,6.0,coordination,stimul,20.0
Borisova_2024,"В последнее время Макар любила и теннис, и волейбол.",1.6236559139784943,2.0,bad,filler,33.0
Borisova_2024,"В июне Гоша украл шины и рейсового, и экскурсионного автобусов.",5.75,6.0,coordination,stimul,14.0
Borisova_2024,"Перед концертом Аня настроила струны и классической, и гавайской гитар.",5.615384615384615,6.0,coordination,stimul,7.0
Borisova_2024,После теста Люба порвала листы черновой и чистовой тетради.,5.230769230769231,5.0,coordination,stimul,10.0
Borisova_2024,После поломки Витя отремонтировал большой и маленький чемоданы.,6.416666666666667,6.0,coordination,stimul,30.0
Borisova_2024,"Во время звонка Эля сломала и старый, и новый телефон.",4.727272727272728,5.0,coordination,stimul,9.0
Borisova_2024,"Во время похода Гриша сфотографировал и глубокую, и мелкую реку.",5.666666666666667,6.0,coordination,stimul,18.0
Borisova_2024,"За выходные Вика заштопала и лыжную, и охотничью куртку.",5.416666666666667,5.0,coordination,stimul,23.0
Borisova_2024,"Перед концертом Аня настроила и классическую, и гавайскую гитару.",5.25,5.0,coordination,stimul,7.0
Borisova_2024,"Во вторник Тася постирала и фиолетовую, и желтую водолазку.",5.083333333333333,5.0,coordination,stimul,20.0
Borisova_2024,На прошлой неделе Ксюша прослушала части фортепианного и скрипичного концерта.,5.230769230769231,5.0,coordination,stimul,32.0
Borisova_2024,Во время прогулки Дима нашел сибирскую и китайскую ели.,5.857142857142857,6.0,coordination,stimul,2.0
Borisova_2024,В июне Гоша украл шины рейсового и экскурсионного автобусов.,5.714285714285714,6.0,coordination,stimul,14.0
Borisova_2024,Перед уроком Настя испачкала страницы толстой и тонкой книг.,5.416666666666667,5.0,coordination,stimul,26.0
Borisova_2024,"Во время прогулки Дима нашел иголки и сибирской, и китайской елей.",5.0,5.0,coordination,stimul,2.0
Borisova_2024,Перед спектаклем Петя вымыл ступени черной и парадной лестниц.,5.416666666666667,5.0,coordination,stimul,15.0
Borisova_2024,"После аварии Миша поменял и личный, и рабочий автомобиль.",4.636363636363637,5.0,coordination,stimul,1.0
Borisova_2024,Во вторник Тася постирала рукава фиолетовой и желтой водолазки.,4.909090909090909,5.0,coordination,stimul,20.0
Borisova_2024,При переезде Даня помял стенки картонной и жестяной коробок.,5.454545454545454,5.0,coordination,stimul,31.0
