experiment,sentence,response,response_round,subtype,type,lexicalization
Davidjuk_2023,"И я, и Паша посетят исторический музей.",2.3,2.0,coordination,stimul,11.0
Davidjuk_2023,"И Олег, и я уточнит необходимую информацию.",2.9,3.0,coordination,stimul,14.0
Davidjuk_2023,Ваня или я отправлю это заказное письмо.,3.7,4.0,coordination,stimul,18.0
Davidjuk_2023,Кеша заправит этот грузовую автомобиль.,2.571428571428572,3.0,bad,filler,33.0
Davidjuk_2023,Я или Юра устроят этот детский праздник.,4.1,4.0,coordination,stimul,12.0
Davidjuk_2023,"И я, и Стёпа попробуем яблочный пирог.",5.3,5.0,coordination,stimul,9.0
Davidjuk_2023,"Или Лёва, или я решат эту сложную задачу.",3.4444444444444446,3.0,coordination,stimul,11.0
Davidjuk_2023,Я или Яша закажем этот дорогой десерт.,4.9,5.0,coordination,stimul,24.0
Davidjuk_2023,Костя или я расскажут эту интересную историю.,3.0,3.0,coordination,stimul,8.0
Davidjuk_2023,Я или Гоша начнём этот непростой разговор.,5.6,6.0,coordination,stimul,28.0
Davidjuk_2023,Я или Миша исправит эту случайную ошибку.,5.0,5.0,coordination,stimul,31.0
Davidjuk_2023,Я и Влад покажет короткую дорогу.,3.0,3.0,coordination,stimul,13.0
Davidjuk_2023,"И Илья, и я выполнят срочное поручение.",2.3,2.0,coordination,stimul,19.0
Davidjuk_2023,Я или Гриша переведёт эту английскую фразу.,4.0,4.0,coordination,stimul,25.0
Davidjuk_2023,Я или Игорь совершим это далёкое путешествие.,4.7,5.0,coordination,stimul,13.0
Davidjuk_2023,"Или Петя, или я подниму этот важный вопрос.",3.6,4.0,coordination,stimul,15.0
Davidjuk_2023,Я или Яша закажет этот дорогой десерт.,2.3,2.0,coordination,stimul,24.0
Davidjuk_2023,Я или Влад покрасят этот новый забор.,2.8,3.0,coordination,stimul,21.0
Davidjuk_2023,"Или я, или Игорь совершим это далёкое путешествие.",3.8,4.0,coordination,stimul,13.0
Davidjuk_2023,"И Володя, и я приобретём ценный опыт.",5.5,6.0,coordination,stimul,16.0
Davidjuk_2023,Костя и я расскажем интересную историю.,4.8,5.0,coordination,stimul,22.0
Davidjuk_2023,Я или Митя составит этот длинный список.,3.6,4.0,coordination,stimul,29.0
Davidjuk_2023,"И Гена, и я продолжат заочное обучение.",2.9,3.0,coordination,stimul,15.0
Davidjuk_2023,Максим и я прогуляют последний урок.,2.8,3.0,coordination,stimul,32.0
Davidjuk_2023,Юра и я устроим детский праздник.,6.2,6.0,coordination,stimul,26.0
Davidjuk_2023,"И Влад, и я покажу короткую дорогу.",2.4,2.0,coordination,stimul,13.0
Davidjuk_2023,Слава и я получу двойную зарплату.,2.8,3.0,coordination,stimul,5.0
Davidjuk_2023,Федя или я выиграю этот теннисный турнир.,4.3,4.0,coordination,stimul,26.0
Davidjuk_2023,Я и Егор прочитаю вводную лекцию.,2.7,3.0,coordination,stimul,18.0
Davidjuk_2023,Денис или Илья нарушим эти строгие сроки.,2.94375,3.0,bad,filler,33.0
Davidjuk_2023,"И Никита, и я попросят дополнительный отгул.",3.7777777777777777,4.0,coordination,stimul,10.0
Davidjuk_2023,Я и Никита попрошу дополнительный отгул.,3.3,3.0,coordination,stimul,10.0
Davidjuk_2023,Данила и я найдут верный ответ.,1.9,2.0,coordination,stimul,20.0
Davidjuk_2023,"Или Влад, или я покрашу этот новый забор.",2.7,3.0,coordination,stimul,21.0
Davidjuk_2023,"Или Влад, или я покрасит этот новый забор.",3.0,3.0,coordination,stimul,21.0
Davidjuk_2023,Я и Дима послушаем праздничный концерт.,6.2,6.0,coordination,stimul,17.0
Davidjuk_2023,"Или я, или Кирилл прополем эту капустную грядку.",4.7,5.0,coordination,stimul,10.0
Davidjuk_2023,Я и Максим сделаю домашнее задание.,2.0,2.0,coordination,stimul,3.0
Davidjuk_2023,Кирилл и я прополет капустную грядку.,2.2,2.0,coordination,stimul,24.0
Davidjuk_2023,Дима или я послушает это голосовое сообщение.,2.1,2.0,coordination,stimul,5.0
Davidjuk_2023,"Витя пропустит или репетицию, или концерт.",5.234177215189874,5.0,good,filler,33.0
Davidjuk_2023,"И Влад, и я покажет короткую дорогу.",2.2,2.0,coordination,stimul,13.0
Davidjuk_2023,"Или Боря, или я закончим эту шахматную партию.",5.3,5.0,coordination,stimul,27.0
Davidjuk_2023,Яша и я приготовлю вкусный обед.,2.9,3.0,coordination,stimul,30.0
Davidjuk_2023,"И Лёва, и я решу сложную задачу.",3.9,4.0,coordination,stimul,25.0
Davidjuk_2023,Илья и я выполним срочное поручение.,5.0,5.0,coordination,stimul,19.0
Davidjuk_2023,Я или Вова споёт эту весёлую песню.,3.1,3.0,coordination,stimul,3.0
Davidjuk_2023,Я и Илья выполню срочное поручение.,2.0,2.0,coordination,stimul,19.0
Davidjuk_2023,Андрей или я увижу этот кукольный спектакль.,3.2,3.0,coordination,stimul,2.0
Davidjuk_2023,Я и Слава получу двойную зарплату.,2.7777777777777777,3.0,coordination,stimul,5.0
Davidjuk_2023,Ваня или я отправит это заказное письмо.,3.6,4.0,coordination,stimul,18.0
Davidjuk_2023,"Или Илья, или я выполнит это срочное задание.",2.9,3.0,coordination,stimul,7.0
Davidjuk_2023,"Или я, или Юра устроит этот детский праздник.",2.8,3.0,coordination,stimul,12.0
Davidjuk_2023,"И Юра, и я устроим детский праздник.",4.9,5.0,coordination,stimul,26.0
Davidjuk_2023,"И я, и Данила найдут верный ответ.",2.6666666666666665,3.0,coordination,stimul,20.0
Davidjuk_2023,Я и Денис пропустим финальный матч.,4.6,5.0,coordination,stimul,12.0
Davidjuk_2023,"Или я, или Дима послушает это голосовое сообщение.",3.6,4.0,coordination,stimul,5.0
Davidjuk_2023,"Или я, или Олег подпишет это деловое соглашение.",3.6,4.0,coordination,stimul,17.0
Davidjuk_2023,Я и Андрей увидим кукольный спектакль.,4.8,5.0,coordination,stimul,4.0
Davidjuk_2023,Я и Ваня возьму краткосрочный отпуск.,2.6,3.0,coordination,stimul,6.0
Davidjuk_2023,Я и Андрей увидят кукольный спектакль.,4.0,4.0,coordination,stimul,4.0
Davidjuk_2023,"И я, и Андрей увидим кукольный спектакль.",5.666666666666667,6.0,coordination,stimul,4.0
Davidjuk_2023,"Или я, или Миша исправим эту случайную ошибку.",5.666666666666667,6.0,coordination,stimul,31.0
Davidjuk_2023,"И я, и Гена продолжу заочное обучение.",2.5,2.0,coordination,stimul,15.0
Davidjuk_2023,"Или Вася, или я проведу это экстренное совещание.",4.0,4.0,coordination,stimul,1.0
Davidjuk_2023,"И Влад, и я покажем короткую дорогу.",4.333333333333333,4.0,coordination,stimul,13.0
Davidjuk_2023,Я и Никита внесём небольшой аванс.,5.1,5.0,coordination,stimul,31.0
Davidjuk_2023,Петя или я поднимут этот важный вопрос.,3.555555555555556,4.0,coordination,stimul,15.0
Davidjuk_2023,"Или я, или Слава куплю эту известную картину.",2.6,3.0,coordination,stimul,19.0
Davidjuk_2023,Я или Никита побелят этот высокий потолок.,3.5,4.0,coordination,stimul,20.0
Davidjuk_2023,"Или я, или Влад покрасим этот новый забор.",4.8,5.0,coordination,stimul,21.0
Davidjuk_2023,Я и Никита попросит дополнительный отгул.,3.2,3.0,coordination,stimul,10.0
Davidjuk_2023,"Или Никита, или я внесёт этот небольшой аванс.",3.2,3.0,coordination,stimul,14.0
Davidjuk_2023,Максим или я приобрету этот старинный дом.,2.727272727272727,3.0,coordination,stimul,22.0
Davidjuk_2023,"И Вася, и я посмотрит документальный фильм.",3.7,4.0,coordination,stimul,2.0
Davidjuk_2023,"И Вася, и я посмотрим документальный фильм.",4.5,4.0,coordination,stimul,2.0
Davidjuk_2023,Я и Вова споём весёлую песню.,5.6,6.0,coordination,stimul,7.0
Davidjuk_2023,"И я, и Максим сделают домашнее задание.",2.2,2.0,coordination,stimul,3.0
Davidjuk_2023,Я или Боря закончим эту шахматную партию.,5.8,6.0,coordination,stimul,27.0
Davidjuk_2023,Я или Лёва решит эту сложную задачу.,3.2,3.0,coordination,stimul,11.0
Davidjuk_2023,Илья и я выполнит срочное поручение.,2.4,2.0,coordination,stimul,19.0
Davidjuk_2023,Паша или я посещу этот научный семинар.,3.9,4.0,coordination,stimul,16.0
Davidjuk_2023,"И я, и Миша сдам вступительный экзамен.",1.9,2.0,coordination,stimul,8.0
Davidjuk_2023,"Или Костя, или я расскажут эту интересную историю.",3.9,4.0,coordination,stimul,8.0
Davidjuk_2023,"И я, и Илья выполнят срочное поручение.",2.8,3.0,coordination,stimul,19.0
Davidjuk_2023,"И Егор, и я прочитают вводную лекцию.",3.8,4.0,coordination,stimul,18.0
Davidjuk_2023,Егор и я прочитает вводную лекцию.,2.3,2.0,coordination,stimul,18.0
Davidjuk_2023,Я или Гриша переведём эту английскую фразу.,3.2,3.0,coordination,stimul,25.0
Davidjuk_2023,"Или я, или Митя составлю этот длинный список.",3.0,3.0,coordination,stimul,29.0
Davidjuk_2023,"И Ваня, и я возьмут краткосрочный отпуск.",3.3,3.0,coordination,stimul,6.0
Davidjuk_2023,Никита покрасит входную дверь.,6.213836477987422,6.0,good,filler,33.0
Davidjuk_2023,Я или Федя выиграю этот теннисный турнир.,2.1,2.0,coordination,stimul,26.0
Davidjuk_2023,"И Кирилл, и я прополю капустную грядку.",2.8,3.0,coordination,stimul,24.0
Davidjuk_2023,"Или я, или Митя составят этот длинный список.",3.5,4.0,coordination,stimul,29.0
Davidjuk_2023,Я и Ваня возьмёт краткосрочный отпуск.,2.8,3.0,coordination,stimul,6.0
Davidjuk_2023,"И я, и Вася посмотрит документальный фильм.",2.6,3.0,coordination,stimul,2.0
Davidjuk_2023,"И я, и Володя приобретёт ценный опыт.",2.0,2.0,coordination,stimul,16.0
Davidjuk_2023,Я или Ваня отправим это заказное письмо.,4.9,5.0,coordination,stimul,18.0
Davidjuk_2023,"Или Андрей, или я увидят этот кукольный спектакль.",3.2,3.0,coordination,stimul,2.0
Davidjuk_2023,Егор и я прочитаем вводную лекцию.,4.6,5.0,coordination,stimul,18.0
Davidjuk_2023,"И Егор, и я прочитаем вводную лекцию.",5.1,5.0,coordination,stimul,18.0
Davidjuk_2023,"И Костя, и я расскажут интересную историю.",3.8,4.0,coordination,stimul,22.0
Davidjuk_2023,"Или Гриша, или я переведёт эту английскую фразу.",3.0,3.0,coordination,stimul,25.0
Davidjuk_2023,Я и Ваня возьмём краткосрочный отпуск.,6.0,6.0,coordination,stimul,6.0
Davidjuk_2023,"И Стёпа, и я попробует яблочный пирог.",2.555555555555556,3.0,coordination,stimul,9.0
Davidjuk_2023,"Или Вася, или я проведут это экстренное совещание.",4.5,4.0,coordination,stimul,1.0
Davidjuk_2023,Я и Юра устрою детский праздник.,2.7,3.0,coordination,stimul,26.0
Davidjuk_2023,Я и Кирилл прополет капустную грядку.,3.2,3.0,coordination,stimul,24.0
Davidjuk_2023,Я или Никита внесём этот небольшой аванс.,4.9,5.0,coordination,stimul,14.0
Davidjuk_2023,Я и Костя расскажет интересную историю.,2.9,3.0,coordination,stimul,22.0
Davidjuk_2023,Я или Максим приобретём этот старинный дом.,4.7,5.0,coordination,stimul,22.0
Davidjuk_2023,Егор или я прочитают эту вводную лекцию.,3.9,4.0,coordination,stimul,6.0
Davidjuk_2023,"Или я, или Саша отнесёт это тяжёлое ведро.",2.5,2.0,coordination,stimul,32.0
Davidjuk_2023,"Или Боря, или я закончат эту шахматную партию.",3.6,4.0,coordination,stimul,27.0
Davidjuk_2023,Я и Миша сдам вступительный экзамен.,3.1,3.0,coordination,stimul,8.0
Davidjuk_2023,Я и Лёва решат сложную задачу.,2.888888888888889,3.0,coordination,stimul,25.0
Davidjuk_2023,Никита и я внесу небольшой аванс.,2.2,2.0,coordination,stimul,31.0
Davidjuk_2023,Я и Гена продолжим заочное обучение.,5.9,6.0,coordination,stimul,15.0
Davidjuk_2023,Я или Никита побелит этот высокий потолок.,2.8,3.0,coordination,stimul,20.0
Davidjuk_2023,"И Миша, и я сдаст вступительный экзамен.",2.2,2.0,coordination,stimul,8.0
Davidjuk_2023,"Или я, или Слава купят эту известную картину.",2.2,2.0,coordination,stimul,19.0
Davidjuk_2023,Андрей и я увидим кукольный спектакль.,5.6,6.0,coordination,stimul,4.0
Davidjuk_2023,Я или Вова споют эту весёлую песню.,2.4,2.0,coordination,stimul,3.0
Davidjuk_2023,Я и Слава получим двойную зарплату.,5.2,5.0,coordination,stimul,5.0
Davidjuk_2023,Гена и я продолжим заочное обучение.,5.7,6.0,coordination,stimul,15.0
Davidjuk_2023,"Или я, или Олег подпишу это деловое соглашение.",2.5,2.0,coordination,stimul,17.0
Davidjuk_2023,Я или Влад покрасим этот новый забор.,4.666666666666667,5.0,coordination,stimul,21.0
Davidjuk_2023,Я и Илья выполним срочное поручение.,6.0,6.0,coordination,stimul,19.0
Davidjuk_2023,"И я, и Яша приготовим вкусный обед.",5.0,5.0,coordination,stimul,30.0
Davidjuk_2023,Я или Яша закажут этот дорогой десерт.,2.9,3.0,coordination,stimul,24.0
Davidjuk_2023,Федя и я разработаю детальный план.,2.6,3.0,coordination,stimul,27.0
Davidjuk_2023,"Или Саша, или я отнесёт это тяжёлое ведро.",3.363636363636364,3.0,coordination,stimul,32.0
Davidjuk_2023,"И я, и Боря подготовит промежуточный отчёт.",2.5,2.0,coordination,stimul,21.0
Davidjuk_2023,Я и Яша приготовим вкусный обед.,5.6,6.0,coordination,stimul,30.0
Davidjuk_2023,"Или Дима, или я послушаю это голосовое сообщение.",3.0,3.0,coordination,stimul,5.0
Davidjuk_2023,"Или Олег, или я подпишут это деловое соглашение.",3.8,4.0,coordination,stimul,17.0
Davidjuk_2023,Я и Вадим соберу нужный материал.,2.1,2.0,coordination,stimul,23.0
Davidjuk_2023,Дима и Ваня уберём ванную комнату.,2.742138364779874,3.0,bad,filler,33.0
Davidjuk_2023,Лёва и я решу сложную задачу.,2.7,3.0,coordination,stimul,25.0
Davidjuk_2023,"И Паша, и я посетим исторический музей.",4.222222222222222,4.0,coordination,stimul,11.0
Davidjuk_2023,Я или Кирилл прополем эту капустную грядку.,4.8,5.0,coordination,stimul,10.0
Davidjuk_2023,"Или я, или Митя составит этот длинный список.",3.3,3.0,coordination,stimul,29.0
Davidjuk_2023,Кирилл и я прополем капустную грядку.,5.1,5.0,coordination,stimul,24.0
Davidjuk_2023,"И я, и Слава получу двойную зарплату.",2.6666666666666665,3.0,coordination,stimul,5.0
Davidjuk_2023,Я и Боря подготовит промежуточный отчёт.,2.0,2.0,coordination,stimul,21.0
Davidjuk_2023,Илья или я выполнит это срочное задание.,2.6,3.0,coordination,stimul,7.0
Davidjuk_2023,Я или Федя выиграем этот теннисный турнир.,4.8,5.0,coordination,stimul,26.0
Davidjuk_2023,"И Паша, и я посетит исторический музей.",2.5,2.0,coordination,stimul,11.0
Davidjuk_2023,Юра или я устроит этот детский праздник.,2.636363636363636,3.0,coordination,stimul,12.0
Davidjuk_2023,Я и Миша сдаст вступительный экзамен.,2.8,3.0,coordination,stimul,8.0
Davidjuk_2023,Кирилл или я прополет эту капустную грядку.,2.888888888888889,3.0,coordination,stimul,10.0
Davidjuk_2023,"И я, и Егор прочитают вводную лекцию.",2.6666666666666665,3.0,coordination,stimul,18.0
Davidjuk_2023,"Или я, или Федя выиграю этот теннисный турнир.",2.8,3.0,coordination,stimul,26.0
Davidjuk_2023,"Или Ваня, или я отправим это заказное письмо.",5.2,5.0,coordination,stimul,18.0
Davidjuk_2023,Я или Миша исправим эту случайную ошибку.,4.888888888888889,5.0,coordination,stimul,31.0
Davidjuk_2023,Максим и я сделают домашнее задание.,2.555555555555556,3.0,coordination,stimul,3.0
Davidjuk_2023,"И я, и Олег уточним необходимую информацию.",4.7,5.0,coordination,stimul,14.0
Davidjuk_2023,"И Яша, и я приготовим вкусный обед.",4.6,5.0,coordination,stimul,30.0
Davidjuk_2023,Никита или я внесут этот небольшой аванс.,3.7,4.0,coordination,stimul,14.0
Davidjuk_2023,"Или я, или Паша посетит этот научный семинар.",3.4,3.0,coordination,stimul,16.0
Davidjuk_2023,"Или я, или Петя подниму этот важный вопрос.",2.5,2.0,coordination,stimul,15.0
Davidjuk_2023,"И я, и Влад покажем короткую дорогу.",3.0,3.0,coordination,stimul,13.0
Davidjuk_2023,"И я, и Стёпа попробую яблочный пирог.",2.4,2.0,coordination,stimul,9.0
Davidjuk_2023,"И я, и Юра устрою детский праздник.",2.0,2.0,coordination,stimul,26.0
Davidjuk_2023,"И Никита, и я попросим дополнительный отгул.",4.7,5.0,coordination,stimul,10.0
Davidjuk_2023,Я или Стёпа исполнят эту оперную арию.,3.8,4.0,coordination,stimul,4.0
Davidjuk_2023,Я и Федя разработаю детальный план.,1.8,2.0,coordination,stimul,27.0
Davidjuk_2023,"Или Лёва, или я решу эту сложную задачу.",4.3,4.0,coordination,stimul,11.0
Davidjuk_2023,"И я, и Миша сдадут вступительный экзамен.",3.6,4.0,coordination,stimul,8.0
Davidjuk_2023,"Или Саша, или Коля прочитаем это длинное письмо.",3.620253164556962,4.0,bad,filler,33.0
Davidjuk_2023,"Или я, или Слава купит эту известную картину.",4.6,5.0,coordination,stimul,19.0
Davidjuk_2023,Яша или я закажет этот дорогой десерт.,3.9,4.0,coordination,stimul,24.0
Davidjuk_2023,Стёпа и я попробую яблочный пирог.,2.9,3.0,coordination,stimul,9.0
Davidjuk_2023,"И я, и Максим прогуляет последний урок.",2.1,2.0,coordination,stimul,32.0
Davidjuk_2023,"Или я, или Вова споют эту весёлую песню.",3.2,3.0,coordination,stimul,3.0
Davidjuk_2023,"Или я, или Никита побелит этот высокий потолок.",2.6,3.0,coordination,stimul,20.0
Davidjuk_2023,Я или Дима послушаем это голосовое сообщение.,4.7,5.0,coordination,stimul,5.0
Davidjuk_2023,Я и Петя нарисую подробную схему.,2.888888888888889,3.0,coordination,stimul,1.0
Davidjuk_2023,"Или я, или Стёпа исполнят эту оперную арию.",2.888888888888889,3.0,coordination,stimul,4.0
Davidjuk_2023,Я или Гена раскрою эту подлое преступление.,2.0,2.0,coordination,stimul,23.0
Davidjuk_2023,"Или я, или Вова споём эту весёлую песню.",4.1,4.0,coordination,stimul,3.0
Davidjuk_2023,Костя и я расскажет интересную историю.,2.4,2.0,coordination,stimul,22.0
Davidjuk_2023,"Или я, или Егор прочитают эту вводную лекцию.",3.5,4.0,coordination,stimul,6.0
Davidjuk_2023,Стёпа и я попробуем яблочный пирог.,6.1,6.0,coordination,stimul,9.0
Davidjuk_2023,Гена или я раскрою эту подлое преступление.,3.3,3.0,coordination,stimul,23.0
Davidjuk_2023,"И Слава, и я получим двойную зарплату.",5.0,5.0,coordination,stimul,5.0
Davidjuk_2023,Лёва или я решит эту сложную задачу.,3.3,3.0,coordination,stimul,11.0
Davidjuk_2023,Я или Костя расскажем эту интересную историю.,4.6,5.0,coordination,stimul,8.0
Davidjuk_2023,"И Володя, и я приобретут ценный опыт.",3.3,3.0,coordination,stimul,16.0
Davidjuk_2023,"Или Юра, или я устрою этот детский праздник.",4.222222222222222,4.0,coordination,stimul,12.0
Davidjuk_2023,Ваня или я отправим это заказное письмо.,5.2,5.0,coordination,stimul,18.0
Davidjuk_2023,"Или я, или Вадим соберём этот нужный материал.",4.1,4.0,coordination,stimul,9.0
Davidjuk_2023,"И Гриша, и я сыграют шахматную партию.",3.8,4.0,coordination,stimul,29.0
Davidjuk_2023,"Или я, или Яша закажем этот дорогой десерт.",4.666666666666667,5.0,coordination,stimul,24.0
Davidjuk_2023,Никита или я побелит этот высокий потолок.,3.1818181818181817,3.0,coordination,stimul,20.0
Davidjuk_2023,Я или Дима послушаю это голосовое сообщение.,3.2222222222222223,3.0,coordination,stimul,5.0
Davidjuk_2023,Я или Гена раскроют это подлое преступление.,2.9,3.0,coordination,stimul,23.0
Davidjuk_2023,"Или Миша, или я исправят эту случайную ошибку.",3.363636363636364,3.0,coordination,stimul,31.0
Davidjuk_2023,Миша или я исправят эту случайную ошибку.,4.0,4.0,coordination,stimul,31.0
Davidjuk_2023,Я и Максим прогуляю последний урок.,3.1,3.0,coordination,stimul,32.0
Davidjuk_2023,Гриша и я сыграют шахматную партию.,2.9,3.0,coordination,stimul,29.0
Davidjuk_2023,"Или я, или Гоша начнут этот непростой разговор.",3.4,3.0,coordination,stimul,28.0
Davidjuk_2023,"И Саша, и Коля оставим длинный комментарий.",2.961783439490446,3.0,bad,filler,33.0
Davidjuk_2023,Никита и я попрошу дополнительный отгул.,1.8,2.0,coordination,stimul,10.0
Davidjuk_2023,Я и Данила найдём верный ответ.,4.8,5.0,coordination,stimul,20.0
Davidjuk_2023,"Или я, или Егор прочитаем эту вводную лекцию.",4.1,4.0,coordination,stimul,6.0
Davidjuk_2023,Лёва и я решит сложную задачу.,1.9,2.0,coordination,stimul,25.0
Davidjuk_2023,"Или Костя, или я расскажем эту интересную историю.",3.8181818181818175,4.0,coordination,stimul,8.0
Davidjuk_2023,Я и Костя расскажу интересную историю.,2.1,2.0,coordination,stimul,22.0
Davidjuk_2023,"Или я, или Влад покрашу этот новый забор.",2.4,2.0,coordination,stimul,21.0
