experiment,sentence,response,response_round,subtype,type,lexicalization
Krainova_2024,Мальчик поймал этих десяток бабочек.,2.583333333333333,3.0,quantitative_nouns,stimul,15.0
Krainova_2024,Коллекционер радуется этим сотне книг.,1.8333333333333333,2.0,quantitative_nouns,stimul,3.0
Krainova_2024,Репортеры сфотографировали этих пару актеров.,4.083333333333333,4.0,quantitative_nouns,stimul,23.0
Krainova_2024,Мальчик подражал паре друзей.,6.479166666666667,6.0,good,filler,501.0
Krainova_2024,На совещание опоздали эти пара коллег.,4.583333333333333,5.0,quantitative_nouns,stimul,4.0
Krainova_2024,Гимнастка пользовался парой булав.,2.1666666666666665,2.0,bad,filler,501.0
Krainova_2024,Туристы любовались тысячей картин.,6.1875,6.0,good,filler,501.0
Krainova_2024,Мастерская отказала этим тысяче заказчиков.,2.333333333333333,2.0,quantitative_nouns,stimul,10.0
Krainova_2024,На верхней полке стоял десяток банок.,5.333333333333333,5.0,good,filler,501.0
Krainova_2024,Следователь опросил десяток свидетелей.,6.916666666666667,7.0,good,filler,501.0
Krainova_2024,Заграждение препятствовало этим десятку водителей.,1.9090909090909087,2.0,quantitative_nouns,stimul,6.0
Krainova_2024,Вася сторонился этих дюжины приятелей.,3.75,4.0,quantitative_nouns,stimul,18.0
Krainova_2024,Фанаты попросили этих десятка песен.,1.5,2.0,quantitative_nouns,stimul,14.0
Krainova_2024,Администрация написала эти тысячу писем.,4.666666666666667,5.0,quantitative_nouns,stimul,11.0
Krainova_2024,Критики манипулировали этими парой ошибок.,3.0,3.0,quantitative_nouns,stimul,24.0
Krainova_2024,В приюте жили эти сотня собак.,2.1666666666666665,2.0,quantitative_nouns,stimul,2.0
Krainova_2024,Актриса удивилась этим тысяче писем.,2.272727272727273,2.0,quantitative_nouns,stimul,11.0
Krainova_2024,В саду рос сотня тюльпанов.,1.1666666666666667,1.0,bad,filler,501.0
Krainova_2024,Священник поверил дюжине клятв.,6.617021276595745,7.0,good,filler,501.0
Krainova_2024,Ребенок подражало десятку знакомых.,1.1875,1.0,bad,filler,501.0
Krainova_2024,От поклонников пришли эти тысяча писем .,3.6666666666666665,4.0,quantitative_nouns,stimul,11.0
Krainova_2024,Спортсмен желал этих десятка наград.,3.4166666666666665,3.0,quantitative_nouns,stimul,13.0
Krainova_2024,На сделку повлияли эти пара встреч.,4.916666666666667,5.0,quantitative_nouns,stimul,5.0
Krainova_2024,Оранжерея лишилась%09этих сотни трав.,7.0,7.0,quantitative_nouns,stimul,21.0
Krainova_2024,Нововведения коснулись этих тысячи школьников.,3.083333333333333,3.0,quantitative_nouns,stimul,12.0
Krainova_2024,Шум мешало паре отдыхающих.,1.0625,1.0,bad,filler,501.0
Krainova_2024,В ограждение врезались эти десяток водителей.,2.833333333333333,3.0,quantitative_nouns,stimul,6.0
Krainova_2024,Меломан увлекся этими десятком песен.,2.333333333333333,2.0,quantitative_nouns,stimul,14.0
Krainova_2024,На небе светили эти тысяча звезд.,4.25,4.0,quantitative_nouns,stimul,7.0
Krainova_2024,Соперники опасались этих десятка игроков.,2.75,3.0,quantitative_nouns,stimul,16.0
Krainova_2024,В баскетбол играли эти десяток игроков.,3.0,3.0,quantitative_nouns,stimul,16.0
Krainova_2024,Полиглот научился этим дюжине языков.,3.4166666666666665,3.0,quantitative_nouns,stimul,1.0
Krainova_2024,Кризис коснулся этих дюжины заводов.,3.75,4.0,quantitative_nouns,stimul,17.0
Krainova_2024,Рыбак продал сотню окуней.,6.6875,7.0,good,filler,501.0
Manina_2022,Утром я с Сашей обсуждаю планы занятий.,5.428571428571429,5.0,coordination,stimul,9.0
Manina_2022,Осенью они с Женей разбирают пыльные антресоли.,5.285714285714286,5.0,coordination,stimul,22.0
Manina_2022,Вечером я и Петя отправляем очередное письмо.,5.416666666666667,5.0,coordination,stimul,3.0
Manina_2022,Вечером я с Димой вспомнил рассказ дедушки.,4.777777777777778,5.0,coordination,stimul,15.0
Manina_2022,Летом вы с Дашей посетили ночной киносеанс.,5.198473282442748,5.0,good ,filler,25.0
Manina_2022,Часто мы с Катей танцуем финское танго.,6.0,6.0,coordination,stimul,2.0
Manina_2022,Весной мы с ним устраиваем большую вечеринку.,5.512195121951219,6.0,good,filler,28.0
Manina_2022,Завтра мы с Никитой заполняем бумаги дедушки.,5.857142857142857,6.0,coordination,stimul,27.0
Manina_2022,Скоро Толя и Витя ставим балет Стравинского.,1.7023809523809523,2.0,bad,filler,28.0
Manina_2022,Вчера он и Боря исполнил вариации Баха.,4.3,4.0,coordination,stimul,1.0
Manina_2022,Вечером я и Дима вспомнил рассказ дедушки.,3.727272727272727,4.0,coordination,stimul,15.0
Manina_2022,Утром я с Сашей прочитали рассказ Брэдбери.,2.125,2.0,coordination,stimul,9.0
Manina_2022,Тогда ты и Коля разбил дорогой сервиз.,3.0,3.0,coordination,stimul,14.0
Manina_2022,Ночью он и Витя придумали маленький сюрприз.,5.15,5.0,coordination,stimul,7.0
Manina_2022,Вечером ты и Дима вспомнили рассказ дедушки.,3.875,4.0,coordination,stimul,15.0
Manina_2022,Сегодня ты с Максимом рисует эскизы костюмов.,1.8333333333333333,2.0,coordination,stimul,26.0
Manina_2022,Вечером вы с Глеб включили старые пластинки.,2.437956204379562,2.0,bad,filler,25.0
Manina_2022,Осенью он с Женей разбирает пыльные антресоли.,4.5,4.0,coordination,stimul,22.0
Manina_2022,Вчера ты с Лёвой изучили возможные риски.,4.454545454545454,4.0,coordination,stimul,19.0
Manina_2022,Часто ты и Ваня нарушаете приказы начальства.,3.6666666666666665,4.0,coordination,stimul,16.0
Manina_2022,Весной вы с Таней покупаете новую одежду.,4.666666666666667,5.0,coordination,stimul,5.0
Manina_2022,Летом вы с Настей делаете холодные коктейли.,5.0,5.0,coordination,stimul,23.0
Manina_2022,Часто я и Катя танцуем финское танго.,5.181818181818182,5.0,coordination,stimul,2.0
Manina_2022,Летом я с Дианой проверяю состояние водоёмов.,5.571428571428571,6.0,coordination,stimul,13.0
Manina_2022,Летом он и Настя делают холодные коктейли.,4.375,4.0,coordination,stimul,23.0
Manina_2022,Завтра он с Никитой заполняет бумаги дедушки.,4.066666666666666,4.0,coordination,stimul,27.0
Manina_2022,Осенью я с Лёшей засушил кленовые листья.,5.444444444444445,5.0,coordination,stimul,8.0
Manina_2022,Обычно ты с Соней осознаёшь возможные риски.,5.0,5.0,coordination,stimul,15.0
Manina_2022,Утром я и Даня продумал план занятий.,2.5454545454545454,3.0,coordination,stimul,4.0
Manina_2022,Сейчас я с Димой снимаю скромную квартиру.,5.833333333333333,6.0,coordination,stimul,12.0
Manina_2022,Вечером я и Лёня зажгли ароматические свечи.,5.6,6.0,coordination,stimul,10.0
Manina_2022,Потом он с Вовой обнаружил ошибку учёного.,4.2727272727272725,4.0,coordination,stimul,21.0
Manina_2022,Скоро мы с Серёжей получаем первую зарплату.,5.571428571428571,6.0,coordination,stimul,17.0
Manina_2022,Утром мы с Сашей обсуждаем планы занятий.,6.666666666666667,7.0,coordination,stimul,9.0
Manina_2022,Ночью он и Миша нарисовал эскизы костюмов.,2.625,3.0,coordination,stimul,11.0
Manina_2022,Утром я с Тёмой сделали холодные коктейли.,5.285714285714286,5.0,coordination,stimul,20.0
Manina_2022,Часто ты с Ваней нарушаешь приказы начальства.,4.416666666666667,4.0,coordination,stimul,16.0
Manina_2022,Сегодня Лёня и Марта печатают раздаточный материал.,5.814814814814815,6.0,good,filler,28.0
Manina_2022,Обычно Таня и Артём проверяют работы школьников.,6.289156626506024,6.0,good,filler,28.0
Manina_2022,Осенью ты с Женей решил проблемы фирмы.,5.222222222222222,5.0,coordination,stimul,16.0
Manina_2022,Утром я с Даней продумали план занятий.,5.0,5.0,coordination,stimul,4.0
Manina_2022,Теперь он и Юля пишут детскую книжку.,4.533333333333333,5.0,coordination,stimul,11.0
Manina_2022,Вечером Тася и Кирилл анализируют биржевые котировки.,5.975609756097561,6.0,good,filler,28.0
Manina_2022,Тогда я с Колей разбил дорогой сервиз.,4.733333333333333,5.0,coordination,stimul,14.0
Manina_2022,Утром он и Даня продумали план занятий.,6.0,6.0,coordination,stimul,4.0
Manina_2022,Весной я и Таня покупаем новую одежду.,5.266666666666667,5.0,coordination,stimul,5.0
Manina_2022,Ночью он и Ваня распечатали материалы лекций.,4.727272727272728,5.0,coordination,stimul,13.0
Manina_2022,Вечером я с Лёней зажёг ароматические свечи.,5.0,5.0,coordination,stimul,10.0
Manina_2022,Утром ты и Даня решаете задачи менеджмента.,4.181818181818182,4.0,coordination,stimul,19.0
Manina_2022,Тогда мы с Алисе доказали теорему Вейерштрасса.,1.8296296296296293,2.0,bad,filler,25.0
Manina_2022,Утром он с Сашей прочитали рассказ Брэдбери.,3.6,4.0,coordination,stimul,9.0
Manina_2022,Зимой я и Света читаем рассказы Брэдбери.,5.142857142857143,5.0,coordination,stimul,21.0
Manina_2022,Утром он с Тёмой сделали холодные коктейли.,3.727272727272727,4.0,coordination,stimul,20.0
Manina_2022,Утром я и Саша прочитал рассказ Брэдбери.,3.1,3.0,coordination,stimul,9.0
Manina_2022,Тогда я с Максом станцевал финское танго.,5.428571428571429,5.0,coordination,stimul,2.0
Manina_2022,Утром ты с Даней решаешь задачи менеджмента.,4.857142857142857,5.0,coordination,stimul,19.0
Manina_2022,Зимой вы с Сашей пропиваете курс витаминов.,4.909090909090909,5.0,coordination,stimul,4.0
Manina_2022,Обычно ты с Люсей находишь верное решение.,5.142857142857143,5.0,coordination,stimul,8.0
Manina_2022,Ночью я с Ваней распечатали материалы лекций.,3.4,3.0,coordination,stimul,13.0
Manina_2022,Завтра ты с Борей исполняешь вариации Баха.,5.133333333333334,5.0,coordination,stimul,1.0
Manina_2022,Сегодня я с Максимом рисую эскизы костюмов.,5.818181818181818,6.0,coordination,stimul,26.0
Manina_2022,Летом они с Колей просмотрели отзывы клиентов.,5.776119402985074,6.0,bad,filler,25.0
Manina_2022,Вечером я и Стёпа слушаем иностранные песни.,5.75,6.0,coordination,stimul,18.0
Manina_2022,Вечером ты с Димой вспомнили рассказ дедушки.,4.444444444444445,4.0,coordination,stimul,15.0
Manina_2022,Зимой он и Саша пропивают курс витаминов.,4.142857142857143,4.0,coordination,stimul,4.0
Manina_2022,Утром он с Тёмой сделал холодные коктейли.,4.105263157894737,4.0,coordination,stimul,20.0
Manina_2022,Вчера ты со Стёпой обсудил предстоящий отпуск.,4.375,4.0,coordination,stimul,5.0
Manina_2022,Утром я с Даней решаю задачи менеджмента.,5.333333333333333,5.0,coordination,stimul,19.0
Manina_2022,Потом я с Никитой разобрали пыльные антресоли.,4.222222222222222,4.0,coordination,stimul,12.0
Manina_2022,Вечером я с Петей отправил очередное письмо.,5.0,5.0,coordination,stimul,3.0
Manina_2022,Осенью он и Лёша засушили кленовые листья.,5.466666666666667,5.0,coordination,stimul,8.0
Manina_2022,Тогда я и Коля разбил дорогой сервиз.,2.55,3.0,coordination,stimul,14.0
Manina_2022,Весной мы с Иосифу составляем рацион питания.,1.8072289156626504,2.0,bad,filler,28.0
Manina_2022,Вчера я с Борей исполнил вариации Баха.,4.777777777777778,5.0,coordination,stimul,1.0
Manina_2022,Зимой вы с Алла утеплили деревянные окна.,1.963235294117647,2.0,bad,filler,25.0
Manina_2022,Ночью я и Ваня распечатал материалы лекций.,2.555555555555556,3.0,coordination,stimul,13.0
Manina_2022,Летом мы с Дианой проверяем состояние водоёмов.,6.4,6.0,coordination,stimul,13.0
Manina_2022,Осенью он с Юрой посетил Дворец Творчества.,5.333333333333333,5.0,coordination,stimul,24.0
Manina_2022,Вчера ты и Стёпа обсудил предстоящий отпуск.,3.2,3.0,coordination,stimul,5.0
Manina_2022,Осенью он и Женя решили проблемы фирмы.,5.555555555555555,6.0,coordination,stimul,16.0
Manina_2022,Вчера ты и Боря исполнили вариации Баха.,5.666666666666667,6.0,coordination,stimul,1.0
Manina_2022,Теперь вы с ними пишете сценарий праздника.,5.125,5.0,good,filler,28.0
Manina_2022,Завтра он с Борей исполняет вариации Баха.,5.0,5.0,coordination,stimul,1.0
Manina_2022,Скоро вы с Серёжей получаете первую зарплату.,4.0,4.0,coordination,stimul,17.0
Manina_2022,Сегодня мы с вами тестируем эффективность рекламы.,6.309523809523809,6.0,good,filler,28.0
Manina_2022,Вечером я и Лёня зажёг ароматические свечи.,3.111111111111111,3.0,coordination,stimul,10.0
Manina_2022,Вечером он и Петя отправил очередное письмо.,3.2,3.0,coordination,stimul,3.0
Manina_2022,Теперь вы с Юлей пишете детскую книжку.,5.5,6.0,coordination,stimul,11.0
Manina_2022,Осенью он с Юрой посетили Дворец Творчества.,5.75,6.0,coordination,stimul,24.0
Manina_2022,Обычно я и Люся находим верное решение.,5.6,6.0,coordination,stimul,8.0
Manina_2022,Зимой я с Сашей пропиваю курс витаминов.,4.666666666666667,5.0,coordination,stimul,4.0
Manina_2022,Тогда он и Федя поняли теорему Гёделя.,4.55,5.0,coordination,stimul,17.0
Manina_2022,Теперь я и Юля пишем детскую книжку.,5.5,6.0,coordination,stimul,11.0
Manina_2022,Вечером ты и Петя отправляете очередное письмо.,4.833333333333333,5.0,coordination,stimul,3.0
Manina_2022,Осенью я с Костей засушиваю кленовые листья.,4.714285714285714,5.0,coordination,stimul,10.0
Manina_2022,Тогда ты и Коля разбили дорогой сервиз.,5.5,6.0,coordination,stimul,14.0
Manina_2022,Осенью он с Женей решил проблемы фирмы.,3.727272727272727,4.0,coordination,stimul,16.0
Manina_2022,Сегодня я и Паша выиграл конкурс чтецов.,3.363636363636364,3.0,coordination,stimul,22.0
Manina_2022,Весной мы с ним устроили большую вечеринку.,5.635036496350365,6.0,good ,filler,25.0
Manina_2022,Часто я и Лена посещаем Дворец Творчества.,5.833333333333333,6.0,coordination,stimul,25.0
Manina_2022,Вечером я с Петей отправили очередное письмо.,4.052631578947368,4.0,coordination,stimul,3.0
Manina_2022,Вчера он и Стёпа обсудил предстоящий отпуск.,2.625,3.0,coordination,stimul,5.0
Manina_2022,Ночью он и Витя придумал маленький сюрприз.,2.625,3.0,coordination,stimul,7.0
Manina_2022,Осенью я и Женя решили проблемы фирмы.,6.133333333333334,6.0,coordination,stimul,16.0
Manina_2022,Потом они с Надю пробежали километровый кросс.,1.72992700729927,2.0,bad,filler,25.0
Manina_2022,Вечером я с Димой вспомнили рассказ дедушки.,4.7368421052631575,5.0,coordination,stimul,15.0
Manina_2022,Осенью они с Машей начали сбор макулатуры.,5.602941176470588,6.0,good ,filler,25.0
Manina_2022,Утром он и Тёма сделал холодные коктейли.,3.0,3.0,coordination,stimul,20.0
Manina_2022,Осенью они с Костей засушивают кленовые листья.,5.75,6.0,coordination,stimul,10.0
Manina_2022,Летом вы с Даша посещаете ночные кинопоказы.,1.9397590361445785,2.0,bad,filler,28.0
Manina_2022,Сейчас он и Вика готовят маленький сюрприз.,5.2,5.0,coordination,stimul,7.0
Manina_2022,Обычно мы с Люсей находим верное решение.,6.428571428571429,6.0,coordination,stimul,8.0
Manina_2022,Завтра я и Лиза измеряем скорость чтения.,4.857142857142857,5.0,coordination,stimul,14.0
Manina_2022,Утром ты и Тёма сделал холодные коктейли.,2.6666666666666665,3.0,coordination,stimul,20.0
Manina_2022,Зимой мы с тобой вырезали бумажные снежинки.,5.902255639097745,6.0,good ,filler,25.0
Manina_2022,Сегодня он и Паша выиграл конкурс чтецов.,2.4444444444444446,2.0,coordination,stimul,22.0
Manina_2022,Осенью вы с Костей засушиваете кленовые листья.,5.5,6.0,coordination,stimul,10.0
Manina_2022,Обычно мы с Соней осознаём возможные риски.,6.166666666666667,6.0,coordination,stimul,15.0
Manina_2022,Сегодня вы с Максимом рисуете эскизы костюмов.,5.285714285714286,5.0,coordination,stimul,26.0
Manina_2022,Скоро ты и Серёжа получаете первую зарплату.,3.375,3.0,coordination,stimul,17.0
Manina_2022,Сегодня они с Юлей представили очередной бизнес-проект.,5.887218045112782,6.0,good ,filler,25.0
Manina_2022,Ночью я и Миша нарисовал эскизы костюмов.,3.3,3.0,coordination,stimul,11.0
Manina_2022,Весной мы с Таней покупаем новую одежду.,5.727272727272728,6.0,coordination,stimul,5.0
Manina_2022,Ночью ты с Витей придумал маленький сюрприз.,3.625,4.0,coordination,stimul,7.0
Manina_2022,Часто он с Леной посещает Дворец Творчества.,5.25,5.0,coordination,stimul,25.0
Manina_2022,Сегодня он с Васей получил первую зарплату.,3.4,3.0,coordination,stimul,18.0
Manina_2022,Завтра он и Боря исполняют вариации Баха.,4.416666666666667,4.0,coordination,stimul,1.0
Manina_2022,Потом я и Серёжа купил новую одежду.,1.8888888888888888,2.0,coordination,stimul,6.0
Manina_2022,Осенью ты и Юра посетили Дворец Творчества.,5.666666666666667,6.0,coordination,stimul,24.0
Manina_2022,Часто они с Катей танцуют финское танго.,6.375,6.0,coordination,stimul,2.0
Manina_2022,Ночью я и Витя придумали маленький сюрприз.,5.875,6.0,coordination,stimul,7.0
Manina_2022,Вечером я с Петей отправляю очередное письмо.,5.714285714285714,6.0,coordination,stimul,3.0
Manina_2022,Летом они с Дианой проверяют состояние водоёмов.,6.285714285714286,6.0,coordination,stimul,13.0
Manina_2022,Теперь они с Юлей пишут детскую книжку.,6.181818181818182,6.0,coordination,stimul,11.0
Manina_2022,Завтра они с Лизой измеряют скорость чтения.,4.933333333333334,5.0,coordination,stimul,14.0
Manina_2022,Часто ты и Катя танцуете финское танго.,4.545454545454546,5.0,coordination,stimul,2.0
Manina_2022,Сегодня он и Вася получил первую зарплату.,3.75,4.0,coordination,stimul,18.0
Manina_2022,Вечером я и Петя отправили очередное письмо.,5.181818181818182,5.0,coordination,stimul,3.0
Manina_2022,Вчера он с Борей исполнил вариации Баха.,5.875,6.0,coordination,stimul,1.0
Manina_2022,Потом я с Вовой обнаружил ошибку учёного.,5.857142857142857,6.0,coordination,stimul,21.0
Manina_2022,Вечером ты с Петей отправляешь очередное письмо.,4.5,4.0,coordination,stimul,3.0
Manina_2022,Весной он с Таней покупает новую одежду.,4.5,4.0,coordination,stimul,5.0
Manina_2022,Зимой Лёва и Арина вырезают бумажные снежинки.,6.308641975308642,6.0,good,filler,28.0
Manina_2022,Потом он с Вовой обнаружили ошибку учёного.,2.636363636363636,3.0,coordination,stimul,21.0
Manina_2022,Вчера он и Лёва изучил возможные риски.,3.8181818181818175,4.0,coordination,stimul,19.0
Manina_2022,Утром я с Даней продумал план занятий.,5.4,5.0,coordination,stimul,4.0
Manina_2022,Вчера я и Стёпа обсудили предстоящий отпуск.,6.111111111111111,6.0,coordination,stimul,5.0
Manina_2022,Утром они с Сашей обсуждают планы занятий.,6.0,6.0,coordination,stimul,9.0
Manina_2022,Сейчас Кеша и Ксюша сочиняете неплохие стихи.,1.987951807228916,2.0,bad,filler,28.0
Manina_2022,Вечером мы с Петей отправляем очередное письмо.,5.9,6.0,coordination,stimul,3.0
Manina_2022,Весной Лада и Олег убирает кабинет отца.,2.463414634146341,2.0,bad,filler,28.0
Manina_2022,Часто ты с Леной посещаешь Дворец Творчества.,6.0,6.0,coordination,stimul,25.0
Manina_2022,Утром они с Даней решают задачи менеджмента.,6.0,6.0,coordination,stimul,19.0
Manina_2022,Потом я с Серёжей купил новую одежду.,4.3,4.0,coordination,stimul,6.0
Manina_2022,Потом он с Никитой разобрали пыльные антресоли.,4.875,5.0,coordination,stimul,12.0
Manina_2022,Осенью ты и Лёша засушил кленовые листья.,2.4,2.0,coordination,stimul,8.0
Manina_2022,Обычно вы с Люсей находите верное решение.,6.166666666666667,6.0,coordination,stimul,8.0
Manina_2022,Весной ты с Таней покупаешь новую одежду.,4.0,4.0,coordination,stimul,5.0
Manina_2022,Скоро мы с Галю подаём патентную заявку.,1.7738095238095235,2.0,bad,filler,28.0
Manina_2022,Вчера я и Стёпа обсудил предстоящий отпуск.,3.733333333333333,4.0,coordination,stimul,5.0
Manina_2022,Вчера он и Лёва изучили возможные риски.,4.727272727272728,5.0,coordination,stimul,19.0
Manina_2022,Потом я и Никита разобрал пыльные антресоли.,3.4,3.0,coordination,stimul,12.0
Manina_2022,Ночью он и Миша нарисовали эскизы костюмов.,5.125,5.0,coordination,stimul,11.0
