author,sentence,response,response_round,subtype,type,lexicalization,condition,gender_match,agreement
Vrubel_2022,"На детский утренник в субботу пришла и мама, и бабушка.",5.2,5.0,coordination,stimul,2,"same conjuncts gender, singular verb",same conjuncts gender,singular verb
Vrubel_2022,"На небольшой лужайке у дома росли и берёза, и дуб.",5.142857142857143,5.0,coordination,stimul,19,"different conjuncts gender, plural verb",different conjuncts gender,plural verb
Vrubel_2022,"Под старой оливой в жару прилегли и молочник, и пастух.",5.428571428571429,5.0,coordination,stimul,14,"same conjuncts gender, plural verb",same conjuncts gender,plural verb
Vrubel_2022,"В новой кукле на витрине привлекали и наряд, и причёска.",5.25,5.0,coordination,stimul,15,"same conjuncts gender, plural verb",same conjuncts gender,plural verb
Vrubel_2022,"В деревянной тумбе около кровати хранился и журнал, и учебник.",4.0,4.0,coordination,stimul,21,"same conjuncts gender, singular verb",same conjuncts gender,singular verb
Vrubel_2022,"На детский утренник в субботу пришла и бабушка, и дед.",3.5384615384615383,4.0,coordination,stimul,2,"different conjuncts gender, singular verb",different conjuncts gender,singular verb
Vrubel_2022,"По узким улочкам по ночам гуляли и актриса, и поэтесса.",6.333333333333333,6.0,coordination,stimul,16,"same conjuncts gender, plural verb",same conjuncts gender,plural verb
Vrubel_2022,"У тёплой печки в морозы грелись и внук, и бабушка.",5.777777777777778,6.0,coordination,stimul,9,"different conjuncts gender, plural verb",different conjuncts gender,plural verb
Vrubel_2022,"На небольшой лужайке у дома росла и берёза, и дуб.",3.5,4.0,coordination,stimul,19,"different conjuncts gender, singular verb",different conjuncts gender,singular verb
Vrubel_2022,"Из раскрывшейся косметички на пол упал и крем, и бальзам.",3.0,3.0,coordination,stimul,27,"same conjuncts gender, singular verb",same conjuncts gender,singular verb
Vrubel_2022,"С большой любовью к Варваре относилась и сестра, и подруга.",3.0,3.0,coordination,stimul,8,"same conjuncts gender, singular verb",same conjuncts gender,singular verb
Vrubel_2022,"На небольшой лужайке у дома росла и берёза, и сосна.",5.0,5.0,coordination,stimul,19,"same conjuncts gender, singular verb",same conjuncts gender,singular verb
Vrubel_2022,Каждую весну на деревенский пруд возвращались утки и селезни.,6.422535211267606,6.0,good,filler,33,good,,
Vrubel_2022,"С небольшим недоверием к учительнице относились и начальница, и уборщица.",5.25,5.0,coordination,stimul,6,"same conjuncts gender, plural verb",same conjuncts gender,plural verb
Vrubel_2022,"В новой столовой на обеде порадовала и закуска, и гарнир.",3.333333333333333,3.0,coordination,stimul,29,"different conjuncts gender, singular verb",different conjuncts gender,singular verb
Vrubel_2022,"В прошлом десятилетии из моды вышел и шёлк, и мех.",4.375,4.0,coordination,stimul,25,"same conjuncts gender, singular verb",same conjuncts gender,singular verb
Vrubel_2022,"В деревенском домике у бабушки отдыхали и брат, и сестра.",6.0,6.0,coordination,stimul,4,"different conjuncts gender, plural verb",different conjuncts gender,plural verb
Vrubel_2022,"Под старой оливой в жару прилегли и молочница, и пастушка.",5.375,5.0,coordination,stimul,14,"same conjuncts gender, plural verb",same conjuncts gender,plural verb
Vrubel_2022,"За долгие годы из памяти стёрся и смех, и дружба.",3.3076923076923075,3.0,coordination,stimul,28,"different conjuncts gender, singular verb",different conjuncts gender,singular verb
Vrubel_2022,"На старой фотографии около дома стоял и скрипач, и художница.",2.6666666666666665,3.0,coordination,stimul,10,"different conjuncts gender, singular verb",different conjuncts gender,singular verb
Vrubel_2022,"С большой любовью к Варваре относились и сестра, и подруга.",5.75,6.0,coordination,stimul,8,"same conjuncts gender, plural verb",same conjuncts gender,plural verb
Vrubel_2022,"В музыкальной школе около дома занимались и сын, и дочка.",6.2,6.0,coordination,stimul,1,"different conjuncts gender, plural verb",different conjuncts gender,plural verb
Vrubel_2022,"Про маленький город на границе знали и бабушка, и мама.",6.5,6.0,coordination,stimul,11,"same conjuncts gender, plural verb",same conjuncts gender,plural verb
Vrubel_2022,"В бескрайней пустыне в полдень мучала и жара, и буря.",3.875,4.0,coordination,stimul,31,"same conjuncts gender, singular verb",same conjuncts gender,singular verb
Vrubel_2022,"В согревающий чай по традиции добавлялись и лимон, и мёд.",6.714285714285714,7.0,coordination,stimul,30,"same conjuncts gender, plural verb",same conjuncts gender,plural verb
Vrubel_2022,"В деревенском домике у бабушки отдыхали и сестра, и брат.",6.5,6.0,coordination,stimul,4,"different conjuncts gender, plural verb",different conjuncts gender,plural verb
Vrubel_2022,"Из раскрывшейся косметички на пол упала и помада, и крем.",3.875,4.0,coordination,stimul,27,"different conjuncts gender, singular verb",different conjuncts gender,singular verb
Vrubel_2022,Цикады и кузнечики шумели в густую траву летним жарким днем.,1.8695652173913044,2.0,bad,filler,33,bad,,
Vrubel_2022,"В бескрайней пустыне в полдень мучали и ветер, и жара.",5.857142857142857,6.0,coordination,stimul,31,"different conjuncts gender, plural verb",different conjuncts gender,plural verb
Vrubel_2022,"На дорогом фортепиано по вечерам играл и учитель, и ученик.",4.0,4.0,coordination,stimul,15,"same conjuncts gender, singular verb",same conjuncts gender,singular verb
Vrubel_2022,"С явным беспокойством на ребёнка смотрела и няня, и отец.",4.571428571428571,5.0,coordination,stimul,7,"different conjuncts gender, singular verb",different conjuncts gender,singular verb
Vrubel_2022,"По узким улочкам по ночам гуляли и актриса, и поэт.",5.833333333333333,6.0,coordination,stimul,16,"different conjuncts gender, plural verb",different conjuncts gender,plural verb
Vrubel_2022,"За долгие годы из памяти стёрлись и дружба, и тоска.",6.142857142857143,6.0,coordination,stimul,28,"same conjuncts gender, plural verb",same conjuncts gender,plural verb
Vrubel_2022,"На большом столе в гостиной всегда лежали и конфеты, и фрукты.",6.397260273972603,6.0,good,filler,33,good,,
Vrubel_2022,"В крошечном магазине в Смоленске продавались и водка, и медовуха.",6.75,7.0,coordination,stimul,32,"same conjuncts gender, plural verb",same conjuncts gender,plural verb
Vrubel_2022,"В старом замке на полу лежала и подстилка, и шкура.",3.6,4.0,coordination,stimul,26,"same conjuncts gender, singular verb",same conjuncts gender,singular verb
Vrubel_2022,"В прошлом десятилетии из моды вышла и вискоза, и парча.",3.888888888888889,4.0,coordination,stimul,25,"same conjuncts gender, singular verb",same conjuncts gender,singular verb
Vrubel_2022,"Он хорошо писал и стихи, и песни о любви.",6.205479452054795,6.0,good,filler,33,good,,
Vrubel_2022,"В новой кукле на витрине привлекал и наряд, и причёска.",4.444444444444445,4.0,coordination,stimul,18,"different conjuncts gender, singular verb",different conjuncts gender,singular verb
Vrubel_2022,"С большой любовью к Варваре относился и брат, и друг.",2.7142857142857144,3.0,coordination,stimul,8,"same conjuncts gender, singular verb",same conjuncts gender,singular verb
Vrubel_2022,"В сильном пожаре на участке сгорели и баня, и конюшня.",5.857142857142857,6.0,coordination,stimul,23,"same conjuncts gender, plural verb",same conjuncts gender,plural verb
Vrubel_2022,"В деревянной тумбе около кровати хранилась и карта, и газета.",3.375,3.0,coordination,stimul,21,"same conjuncts gender, singular verb",same conjuncts gender,singular verb
Vrubel_2022,"На старой фотографии около дома стояли и скрипачка, и художница.",3.5,4.0,coordination,stimul,10,"same conjuncts gender, plural verb",same conjuncts gender,plural verb
Vrubel_2022,Облака и тучи сгустились над головами уставших путников.,6.452054794520548,6.0,good,filler,33,good,,
Vrubel_2022,"В сильном пожаре на участке сгорел и дом, и баня.",3.5,4.0,coordination,stimul,23,"different conjuncts gender, singular verb",different conjuncts gender,singular verb
Vrubel_2022,"Под старой оливой в жару прилегла и молочница, и пастух.",3.888888888888889,4.0,coordination,stimul,14,"different conjuncts gender, singular verb",different conjuncts gender,singular verb
Vrubel_2022,"В гадком супе в котле плавал и сельдерей, и свёкла.",3.3076923076923075,3.0,coordination,stimul,20,"different conjuncts gender, singular verb",different conjuncts gender,singular verb
Vrubel_2022,"Среди гор одежды был закопан и старые юбки, и платья.",1.4109589041095891,1.0,bad,filler,33,bad,,
Vrubel_2022,"В сильном пожаре на участке сгорели и баня, и дом.",6.0,6.0,coordination,stimul,23,"different conjuncts gender, plural verb",different conjuncts gender,plural verb
Vrubel_2022,"В жаркое лето на огороде вырос и огурец, и кабачок.",3.25,3.0,coordination,stimul,17,"same conjuncts gender, singular verb",same conjuncts gender,singular verb
Vrubel_2022,"С небольшим недоверием к учительнице относилась и начальница, и уборщица.",2.583333333333333,3.0,coordination,stimul,6,"same conjuncts gender, singular verb",same conjuncts gender,singular verb
Vrubel_2022,"Из раскрывшейся косметички на пол упали и помада, и крем.",5.642857142857143,6.0,coordination,stimul,27,"different conjuncts gender, plural verb",different conjuncts gender,plural verb
Vrubel_2022,"На небольшой лужайке у дома рос и клён, и дуб.",3.6666666666666665,4.0,coordination,stimul,19,"same conjuncts gender, singular verb",same conjuncts gender,singular verb
Vrubel_2022,"На дорогом фортепиано по вечерам играл и учитель, и ученица.",3.333333333333333,3.0,coordination,stimul,15,"different conjuncts gender, singular verb",different conjuncts gender,singular verb
Vrubel_2022,"В гадком супе в котле плавала и свёкла, и сельдерей.",3.142857142857143,3.0,coordination,stimul,20,"different conjuncts gender, singular verb",different conjuncts gender,singular verb
Vrubel_2022,"В согревающий чай по традиции добавлялись и гвоздика, и лимон.",5.666666666666667,6.0,coordination,stimul,30,"different conjuncts gender, plural verb",different conjuncts gender,plural verb
Vrubel_2022,"В длинном проигрыше в песне звучали и электрогитара, и орган.",5.5,6.0,coordination,stimul,22,"different conjuncts gender, plural verb",different conjuncts gender,plural verb
Vrubel_2022,"В гадком супе в котле плавал и сельдерей, и баклажан.",4.0,4.0,coordination,stimul,20,"same conjuncts gender, singular verb",same conjuncts gender,singular verb
Vrubel_2022,"С небольшим недоверием к учительнице относился и директор, и секретарь.",3.4444444444444446,3.0,coordination,stimul,6,"same conjuncts gender, singular verb",same conjuncts gender,singular verb
Vrubel_2022,"На роскошной клумбе моей бабушки и розы, и помидоры росли боком о бока.",1.7808219178082192,2.0,bad,filler,33,bad,,
Vrubel_2022,"В сильном пожаре на участке сгорела и баня, и дом.",4.428571428571429,4.0,coordination,stimul,23,"different conjuncts gender, singular verb",different conjuncts gender,singular verb
Vrubel_2022,"В новой столовой на обеде порадовал и гарнир, и закуска.",3.0,3.0,coordination,stimul,29,"different conjuncts gender, singular verb",different conjuncts gender,singular verb
Vrubel_2022,"За долгие годы из памяти стёрлись и дружба, и смех.",5.75,6.0,coordination,stimul,28,"different conjuncts gender, plural verb",different conjuncts gender,plural verb
Vrubel_2022,"У тёплой печки в морозы грелся и внук, и дед.",4.625,5.0,coordination,stimul,9,"same conjuncts gender, singular verb",same conjuncts gender,singular verb
Vrubel_2022,"На маленькой скамейке в саду поместились и отец, и сын.",6.0,6.0,coordination,stimul,3,"same conjuncts gender, plural verb",same conjuncts gender,plural verb
Vrubel_2022,"В крошечном магазине в Смоленске продавались и ром, и коньяк.",6.0,6.0,coordination,stimul,32,"same conjuncts gender, plural verb",same conjuncts gender,plural verb
Vrubel_2022,"По узким улочкам по ночам гуляла и актриса, и поэтесса.",3.0,3.0,coordination,stimul,16,"same conjuncts gender, singular verb",same conjuncts gender,singular verb
Vrubel_2022,"За долгие годы из памяти стёрся и смех, и плач.",4.8,5.0,coordination,stimul,28,"same conjuncts gender, singular verb",same conjuncts gender,singular verb
Vrubel_2022,"На старой фотографии около дома стоял и скрипач, и художник.",2.7142857142857144,3.0,coordination,stimul,10,"same conjuncts gender, singular verb",same conjuncts gender,singular verb
Vrubel_2022,"Про маленький город на границе знал и дед, и мама.",2.875,3.0,coordination,stimul,11,"different conjuncts gender, singular verb",different conjuncts gender,singular verb
Vrubel_2022,"На маленькой скамейке в саду поместился и отец, и сын.",3.6666666666666665,4.0,coordination,stimul,3,"same conjuncts gender, singular verb",same conjuncts gender,singular verb
Vrubel_2022,"В длинном проигрыше в песне звучали и орган, и барабан.",6.857142857142857,7.0,coordination,stimul,22,"same conjuncts gender, plural verb",same conjuncts gender,plural verb
Vrubel_2022,"За долгие годы из памяти стёрлись и смех, и плач.",6.777777777777778,7.0,coordination,stimul,28,"same conjuncts gender, plural verb",same conjuncts gender,plural verb
Vrubel_2022,"В жаркое лето на огороде вырос и тыква, и кабачок.",1.625,2.0,coordination,stimul,17,"different conjuncts gender, singular verb",different conjuncts gender,singular verb
Vrubel_2022,По маленьким баночкам были разлиты загадочному маслу и раствору.,1.2083333333333333,1.0,bad,filler,33,bad,,
Vrubel_2022,Около телевизора лежали много диски с фильмами и сериалами про динозавров.,1.2222222222222223,1.0,bad,filler,33,bad,,
Vrubel_2022,"На детский утренник в субботу пришли и дед, и бабушка.",6.571428571428571,7.0,coordination,stimul,2,"different conjuncts gender, plural verb",different conjuncts gender,plural verb
Vrubel_2022,"На физическом факультете в университете училась и мама, и тётя.",3.4,3.0,coordination,stimul,12,"same conjuncts gender, singular verb",same conjuncts gender,singular verb
Vrubel_2022,"С большой любовью к Варваре относился и брат, и подруга.",3.2,3.0,coordination,stimul,8,"different conjuncts gender, singular verb",different conjuncts gender,singular verb
Vrubel_2022,"В прошлом десятилетии из моды вышел и шёлк, и вискоза.",3.7142857142857135,4.0,coordination,stimul,25,"different conjuncts gender, singular verb",different conjuncts gender,singular verb
Vrubel_2022,"С небольшим недоверием к учительнице относились и директор, и уборщица.",5.142857142857143,5.0,coordination,stimul,6,"different conjuncts gender, plural verb",different conjuncts gender,plural verb
Vrubel_2022,"В старом замке на полу лежали и ковёр, и шкура.",5.285714285714286,5.0,coordination,stimul,26,"different conjuncts gender, plural verb",different conjuncts gender,plural verb
Vrubel_2022,"На маленькой скамейке в саду поместились и мама, и ребёнок.",6.285714285714286,6.0,coordination,stimul,3,"different conjuncts gender, plural verb",different conjuncts gender,plural verb
Vrubel_2022,"В новой столовой на обеде порадовал и гарнир, и суп.",2.857142857142857,3.0,coordination,stimul,29,"same conjuncts gender, singular verb",same conjuncts gender,singular verb
Vrubel_2022,"В душной аудитории у окна сидели и студентка, и профессор.",5.0,5.0,coordination,stimul,13,"different conjuncts gender, plural verb",different conjuncts gender,plural verb
Vrubel_2022,"В деревянной тумбе около кровати хранились и газета, и журнал.",5.5,6.0,coordination,stimul,21,"different conjuncts gender, plural verb",different conjuncts gender,plural verb
Vrubel_2022,"На физическом факультете в университете учились и отец, и мама.",5.5,6.0,coordination,stimul,12,"different conjuncts gender, plural verb",different conjuncts gender,plural verb
Vrubel_2022,"Из раскрывшейся косметички на пол упали и крем, и помада.",5.9,6.0,coordination,stimul,27,"different conjuncts gender, plural verb",different conjuncts gender,plural verb
Vrubel_2022,"Под старой оливой в жару прилег и молочник, и пастух.",3.0,3.0,coordination,stimul,14,"same conjuncts gender, singular verb",same conjuncts gender,singular verb
Vrubel_2022,"В прошлом десятилетии из моды вышли и вискоза, и шёлк.",4.666666666666667,5.0,coordination,stimul,25,"different conjuncts gender, plural verb",different conjuncts gender,plural verb
Vrubel_2022,"В деревенском домике у бабушки отдыхали и сын, и племянник.",5.888888888888889,6.0,coordination,stimul,4,"same conjuncts gender, plural verb",same conjuncts gender,plural verb
Vrubel_2022,"В жаркое лето на огороде выросла и тыква, и репа.",4.666666666666667,5.0,coordination,stimul,17,"same conjuncts gender, singular verb",same conjuncts gender,singular verb
Vrubel_2022,"В жаркое лето на огороде выросли и тыква, и кабачок.",6.0,6.0,coordination,stimul,17,"different conjuncts gender, plural verb",different conjuncts gender,plural verb
Vrubel_2022,"Про маленький город на границе знали и дед, и мама.",6.0,6.0,coordination,stimul,11,"different conjuncts gender, plural verb",different conjuncts gender,plural verb
Vrubel_2022,"По узким улочкам по ночам гуляли и актёр, и поэт.",5.25,5.0,coordination,stimul,16,"same conjuncts gender, plural verb",same conjuncts gender,plural verb
Vrubel_2022,"На маленькой скамейке в саду поместились и ребёнок, и мама.",5.9,6.0,coordination,stimul,3,"different conjuncts gender, plural verb",different conjuncts gender,plural verb
Vrubel_2022,"На физическом факультете в университете учились и отец, и сын.",5.777777777777778,6.0,coordination,stimul,12,"same conjuncts gender, plural verb",same conjuncts gender,plural verb
Vrubel_2022,"В прошлом десятилетии из моды вышли и шёлк, и мех.",5.357142857142857,5.0,coordination,stimul,25,"same conjuncts gender, plural verb",same conjuncts gender,plural verb
Vrubel_2022,"И шпицы, и овчарки бегали на собачьей площадке по субботам.",5.971428571428572,6.0,good,filler,33,good,,
Vrubel_2022,"В жаркое лето на огороде вырос и кабачок, и тыква.",3.857142857142857,4.0,coordination,stimul,17,"different conjuncts gender, singular verb",different conjuncts gender,singular verb
Vrubel_2022,"По узким улочкам по ночам гуляла и актриса, и поэт.",1.8888888888888888,2.0,coordination,stimul,16,"different conjuncts gender, singular verb",different conjuncts gender,singular verb
Vrubel_2022,"Про маленький город на границе знали и мама, и дед.",5.857142857142857,6.0,coordination,stimul,11,"different conjuncts gender, plural verb",different conjuncts gender,plural verb
Vrubel_2022,"В крошечном магазине в Смоленске продавались и водка, и ром.",6.833333333333333,7.0,coordination,stimul,32,"different conjuncts gender, plural verb",different conjuncts gender,plural verb
Vrubel_2022,"На детский утренник в субботу пришли и мама, и бабушка.",6.875,7.0,coordination,stimul,2,"same conjuncts gender, plural verb",same conjuncts gender,plural verb
Vrubel_2022,"На дорогом фортепиано по вечерам играла и учительница, и ученик.",4.714285714285714,5.0,coordination,stimul,15,"different conjuncts gender, singular verb",different conjuncts gender,singular verb
Vrubel_2022,"По узким улочкам по ночам гулял и актёр, и поэт.",3.7142857142857135,4.0,coordination,stimul,16,"same conjuncts gender, singular verb",same conjuncts gender,singular verb
Vrubel_2022,"На маленькой скамейке в саду поместилась и мама, и дочка.",5.0,5.0,coordination,stimul,3,"same conjuncts gender, singular verb",same conjuncts gender,singular verb
Vrubel_2022,"В новой кукле на витрине привлекали и причёска, и наряд.",3.875,4.0,coordination,stimul,18,"different conjuncts gender, plural verb",different conjuncts gender,plural verb
Vrubel_2022,"Под старой оливой в жару прилегли и пастух, и молочница.",5.571428571428571,6.0,coordination,stimul,14,"different conjuncts gender, plural verb",different conjuncts gender,plural verb
Vrubel_2022,"С явным беспокойством на ребёнка смотрел и отец, и няня.",2.888888888888889,3.0,coordination,stimul,7,"different conjuncts gender, singular verb",different conjuncts gender,singular verb
Vrubel_2022,"В старом замке на полу лежали и ковёр, и плед.",5.625,6.0,coordination,stimul,26,"same conjuncts gender, plural verb",same conjuncts gender,plural verb
Vrubel_2022,"На маленькой скамейке в саду поместился и ребёнок, и мама.",4.125,4.0,coordination,stimul,3,"different conjuncts gender, singular verb",different conjuncts gender,singular verb
Vrubel_2022,"В бескрайней пустыне в полдень мучали и жара, и буря.",4.714285714285714,5.0,coordination,stimul,31,"same conjuncts gender, plural verb",same conjuncts gender,plural verb
Vrubel_2022,"В крошечном магазине в Смоленске продавались и ром, и водка.",5.888888888888889,6.0,coordination,stimul,32,"different conjuncts gender, plural verb",different conjuncts gender,plural verb
